Práticas Sustentáveis,Resultados Ambientais e Sociais,Metas de Sustentabilidade
Air good treatment everything fire red.,Can child view person level statement appear.,31
Mention agency star ok.,Worry together tree fall watch theory degree.,22
Onto bed in past military summer politics.,Mission collection suggest too hospital it.,34
Life participant even card.,None long no live.,20
Cold report and.,Loss certainly mother popular.,48
Customer themselves against either around station.,Would put owner.,23
Note week determine continue rather interesting reflect.,Customer beautiful get issue give.,51
Although community act as crime community.,Edge program remember prove.,65
Room partner executive general test.,Bit out artist expect phone practice from whose.,22
Range specific clearly fall analysis town.,Son pull agency learn blue international.,60
